id,title,sector,skills_required,location,description
1,Data Science Intern,Data Science,python;pandas;ml,New Delhi,Work on data cleaning and basic model evaluation
2,Frontend Intern,Web Development,html;css;javascript,Hyderabad,Assist with building responsive UI
3,Content Writing Intern,Content,writing;editing;seo,Kolkata,Create content for outreach and reports
4,Agritech Field Intern,Agriculture,field work;data collection,Rural Uttar Pradesh,Collect field data and support farmers
5,UI/UX Intern,Design,figma;ux;research,Bengaluru,Support research and wireframing tasks
6,Social Impact Intern,Public Policy,survey;research;community,Rural Tamil Nadu,Support community surveys and impact measurement
